user_id,name,username,age,gender,user_address,preferred_time_slot,total_booking,cancel_booking,cancel_rate,user_district,min_budget,max_budget,is_banned
164,Lê Nhật Việt,lenhatviet_164,52,nam,"Đường Hoàng Minh Giám, Phường 4, Quận Phú Nhuận",07:00-09:00,8,1,0.125,Quận Phú Nhuận,125000,200000,1
165,Trương Nhật Châu,truongnhatchau_165,60,nữ,"Đường Huỳnh Mẫn Đạt, Phường 3, Quận 5",09:00-11:00,52,34,0.654,Quận 5,220000,220000,1
166,Huỳnh Thanh Hùng,huynhthanhhung_166,30,nữ,"Đường Quốc Lộ 1K, Phường Linh Xuân, TP Thủ Đức",12:00-14:00,63,55,0.873,TP Thủ Đức,115000,180000,1
167,Lý Quang Hải,lyquanghai_167,33,không muốn tiết lộ,"Đường Nguyễn Thị Thập, Phường Tân Quy, Quận 7",06:00-08:00,47,41,0.872,Quận 7,220000,230000,1
168,Hoàng Anh Anh,hoanganhanh_168,38,nam,"Đường Bưng Ông Thoàn, Phường Phú Hữu, TP Thủ Đức",09:00-11:00,95,65,0.684,TP Thủ Đức,190000,205000,1
169,Bùi Hồng Quân,buihongquan_169,17,nữ,"Đường Thạnh Xuân 25, Phường Thạnh Xuân, Quận 12",10:00-12:00,66,66,1.0,Quận 12,180000,205000,1
170,Lê Thị An,lethian_170,53,nam,"Đường Hồng Bàng, Phường 1, Quận 11",20:00-22:00,94,63,0.67,Quận 11,80000,245000,1
171,Hoàng Văn Chi,hoangvanchi_171,50,nam,"Đường Tên Lửa, Phường An Lạc A, Quận Bình Tân",09:00-11:00,22,11,0.5,Quận Bình Tân,100000,210000,1
172,Bùi Ngọc Uyên,buingocuyen_172,36,nam,"Đường Tân Thuận, Phường Tân Thuận Tây, Quận 7",06:00-08:00,29,14,0.483,Quận 7,215000,235000,1
173,Võ Thanh Thu,vothanhthu_173,45,không muốn tiết lộ,"Đường Nguyễn Thị Tần, Phường 2, Quận 8",16:00-18:00,9,6,0.667,Quận 8,135000,165000,1
174,Lý Tuấn Ngân,lytuanngan_174,38,nữ,"Đường Gò Xoài, Phường Bình Hưng Hòa A, Quận Bình Tân",07:00-09:00,94,68,0.723,Quận Bình Tân,145000,225000,1
175,Đoàn Anh Hiếu,doananhhieu_175,33,nữ,"Đường Hà Huy Giáp, Phường Thạnh Lộc, Quận 12",18:00-20:00,53,12,0.226,Quận 12,225000,250000,1
176,Phan Văn Hân,phanvanhan_176,16,nữ,"Đường Long Phước, Phường Long Phước, TP Thủ Đức",14:00-16:00,2,2,1.0,TP Thủ Đức,95000,225000,1
177,Đặng Gia Trang,danggiatrang_177,32,nam,"Đường Lãnh Binh Thăng, Phường 11, Quận 11",18:00-20:00,55,29,0.527,Quận 11,230000,245000,1
178,Phạm Nhật Trung,phamnhattrung_178,20,nam,"Đường Triệu Quang Phục, Phường 10, Quận 5",08:00-10:00,93,58,0.624,Quận 5,65000,215000,1
179,Huỳnh Minh Phát,huynhminhphat_179,37,nữ,"Đường An Dương Vương, Phường 12, Quận 6",07:00-09:00,14,0,0.0,Quận 6,155000,195000,1
180,Đoàn Hồng Huy,doanhonghuy_180,14,nữ,"Đường Nguyễn Ảnh Thủ, Phường Tân Chánh Hiệp, Quận 12",09:00-11:00,21,3,0.143,Quận 12,210000,215000,1
181,Trần Thị Trung,tranthitrung_181,56,nam,"Đường Bình Thới, Phường 10, Quận 11",14:00-16:00,69,23,0.333,Quận 11,235000,245000,1
182,Phạm Hồng Hương,phamhonghuong_182,48,nam,"Đường Trần Hưng Đạo, Phường Cầu Kho, Quận 1",08:00-10:00,97,10,0.103,Quận 1,165000,235000,1
183,Nguyễn Minh Hiếu,nguyenminhhieu_183,41,nữ,"Đường Xa Lộ Hà Nội, Phường An Phú, TP Thủ Đức",19:00-21:00,90,88,0.978,TP Thủ Đức,95000,235000,1
184,Vũ Văn Quyên,vuvanquyen_184,17,nữ,"Đường Dương Quảng Hàm, Phường 5, Quận Gò Vấp",12:00-14:00,66,42,0.636,Quận Gò Vấp,235000,250000,1
185,Lê Nhật Tuấn,lenhattuan_185,15,nam,"Đường Cao Thắng, Phường 11, Quận 10",10:00-12:00,16,3,0.188,Quận 10,175000,250000,1
186,Hoàng Tuấn Trí,hoangtuantri_186,60,nam,"Đường Lê Văn Khương, Phường Hiệp Thành, Quận 12",09:00-11:00,63,11,0.175,Quận 12,150000,245000,1
187,Trương Ngọc Thảo,truongngocthao_187,34,nữ,"Đường Bến Bình Đông, Phường 8, Quận 8",14:00-16:00,82,14,0.171,Quận 8,70000,165000,1
188,Lâm Hồng Minh,lamhongminh_188,33,không muốn tiết lộ,"Đường Tân Vĩnh, Phường 4, Quận 4",07:00-09:00,24,9,0.375,Quận 4,140000,250000,1
189,Phạm Minh Hân,phamminhhan_189,44,nữ,"Đường Lã Xuân Oai, Phường Long Trường, TP Thủ Đức",09:00-11:00,78,9,0.115,TP Thủ Đức,65000,190000,1
190,Võ Hoàng Mai,vohoangmai_190,25,không muốn tiết lộ,"Đường Hưng Phú, Phường 9, Quận 8",18:00-20:00,64,34,0.531,Quận 8,135000,145000,1
191,Nguyễn Thị Linh,nguyenthilinh_191,56,nam,"Đường Ba Vân, Phường 14, Quận Tân Bình",18:00-20:00,91,11,0.121,Quận Tân Bình,75000,235000,1
192,Trần Hồng Trung,tranhongtrung_192,30,nam,"Đường Quốc Lộ 22, Phường Trung Mỹ Tây, Quận 12",14:00-16:00,89,57,0.64,Quận 12,140000,195000,1
193,Đoàn Phú Thắng,doanphuthang_193,34,không muốn tiết lộ,"Đường Quang Trung, Phường 8, Quận Gò Vấp",20:00-22:00,58,58,1.0,Quận Gò Vấp,80000,80000,1
194,Lê Ngọc Vân,lengocvan_194,32,nữ,"Đường Quốc Lộ 1A, Phường Linh Xuân, TP Thủ Đức",07:00-09:00,37,26,0.703,TP Thủ Đức,205000,250000,1
195,Huỳnh Văn Hùng,huynhvanhung_195,18,nữ,"Đường Nguyễn Văn Trỗi, Phường 15, Quận Phú Nhuận",09:00-11:00,98,77,0.786,Quận Phú Nhuận,110000,110000,1
196,Đặng Quang Dũng,dangquangdung_196,20,nữ,"Đường Tân Kỳ Tân Quý, Phường Tân Quý, Quận Tân Phú",06:00-08:00,33,25,0.758,Quận Tân Phú,175000,200000,1
197,Huỳnh Khánh Quyên,huynhkhanhquyen_197,59,nam,"Đường Hoàng Diệu, Phường 9, Quận 4",20:00-22:00,53,6,0.113,Quận 4,110000,240000,1
198,Đoàn Anh Khánh,doananhkhanh_198,19,nam,"Đường Phạm Thế Hiển, Phường 3, Quận 8",12:00-14:00,97,64,0.66,Quận 8,115000,200000,1
199,Lý Minh Trung,lyminhtrung_199,26,nữ,"Đường Song Hành, Phường Tân Hưng Thuận, Quận 12",08:00-10:00,27,23,0.852,Quận 12,80000,240000,1
200,Vũ Tuấn Long,vutuanlong_200,17,nam,"Đường Thanh Đa, Phường 27, Quận Bình Thạnh",20:00-22:00,33,11,0.333,Quận Bình Thạnh,90000,240000,1
201,Lý Anh Khánh,lyanhkhanh_201,44,nữ,"Đường Trần Trọng Cung, Phường Tân Thuận Đông, Quận 7",12:00-14:00,79,46,0.582,Quận 7,100000,150000,1
202,Bùi Đức Hà,buiducha_202,53,nữ,"Đường Lê Văn Quới, Phường Bình Trị Đông A, Quận Bình Tân",06:00-08:00,27,9,0.333,Quận Bình Tân,105000,245000,1
203,Phan Phú Hân,phanphuhan_203,47,nữ,"Đường Nguyễn Trãi, Phường 3, Quận 5",16:00-18:00,12,8,0.667,Quận 5,155000,175000,1
204,Nguyễn Thanh Việt,nguyenthanhviet_204,36,nam,"Đường Trần Quang Diệu, Phường 13, Quận 3",18:00-20:00,77,38,0.494,Quận 3,220000,230000,1
205,Huỳnh Anh Phong,huynhanhphong_205,36,nam,"Đường Phan Đăng Lưu, Phường 7, Quận Phú Nhuận",08:00-10:00,60,37,0.617,Quận Phú Nhuận,115000,210000,1
206,Đặng Hoàng Sơn,danghoangson_206,45,nam,"Đường Nguyên Hồng, Phường 1, Quận Gò Vấp",07:00-09:00,68,41,0.603,Quận Gò Vấp,100000,250000,1
207,Vũ Thị Hùng,vuthihung_207,43,không muốn tiết lộ,"Đường Phan Văn Trị, Phường 10, Quận Gò Vấp",14:00-16:00,51,8,0.157,Quận Gò Vấp,225000,230000,1
208,Huỳnh Hoàng Hải,huynhhoanghai_208,26,nam,"Đường Lạc Long Quân, Phường 8, Quận Tân Bình",19:00-21:00,99,80,0.808,Quận Tân Bình,215000,245000,1
209,Huỳnh Gia Thu,huynhgiathu_209,54,nam,"Đường Nguyễn Thượng Hiền, Phường 5, Quận Bình Thạnh",19:00-21:00,18,3,0.167,Quận Bình Thạnh,130000,155000,1
210,Võ Anh Ngân,voanhngan_210,16,nam,"Đường Đường số 7, Phường Bình Trị Đông B, Quận Bình Tân",16:00-18:00,23,10,0.435,Quận Bình Tân,100000,135000,1
211,Đoàn Tuấn Khánh,doantuankhanh_211,18,nữ,"Đường Chợ Lớn, Phường 11, Quận 6",20:00-22:00,52,29,0.558,Quận 6,185000,200000,1
212,Lý Ngọc Hòa,lyngochoa_212,54,nam,"Đường Hoàng Văn Thụ, Phường 1, Quận Tân Bình",18:00-20:00,14,10,0.714,Quận Tân Bình,120000,230000,1
213,Lý Hồng Huy,lyhonghuy_213,46,nữ,"Đường Hoàng Diệu 2, Phường Linh Chiểu, TP Thủ Đức",16:00-18:00,3,0,0.0,TP Thủ Đức,140000,240000,1
214,Hoàng Đức Vân,hoangducvan_214,15,nam,"Đường Minh Phụng, Phường 5, Quận 6",07:00-09:00,98,98,1.0,Quận 6,80000,90000,1
215,Phan Khánh Nam,phankhanhnam_215,18,nam,"Đường Lý Thái Tổ, Phường 9, Quận 10",20:00-22:00,93,57,0.613,Quận 10,115000,250000,1
216,Nguyễn Phú Phát,nguyenphuphat_216,28,nam,"Đường Lê Văn Khương, Phường Thới An, Quận 12",19:00-21:00,92,55,0.598,Quận 12,135000,165000,1
217,Huỳnh Gia Hùng,huynhgiahung_217,60,nữ,"Đường Tỉnh Lộ 43, Phường Bình Chiểu, TP Thủ Đức",12:00-14:00,59,13,0.22,TP Thủ Đức,250000,250000,1
218,Huỳnh Văn Ngân,huynhvanngan_218,24,nam,"Đường Đề Thám, Phường Phạm Ngũ Lão, Quận 1",16:00-18:00,31,0,0.0,Quận 1,55000,135000,1
219,Bùi Hoàng Minh,buihoangminh_219,40,nữ,"Đường Kinh Dương Vương, Phường An Lạc, Quận Bình Tân",12:00-14:00,22,8,0.364,Quận Bình Tân,120000,135000,1
220,Mai Văn Long,maivanlong_220,20,nữ,"Đường Long Phước, Phường Long Phước, TP Thủ Đức",16:00-18:00,53,17,0.321,TP Thủ Đức,100000,140000,1
221,Mai Nhật Trang,mainhattrang_221,25,nữ,"Đường Hà Huy Giáp, Phường Thạnh Xuân, Quận 12",19:00-21:00,56,6,0.107,Quận 12,140000,240000,1
222,Bùi Ngọc Duy,buingocduy_222,32,nam,"Đường Hiệp Bình, Phường Hiệp Bình Phước, TP Thủ Đức",20:00-22:00,6,3,0.5,TP Thủ Đức,85000,165000,1
223,Võ Thị Phát,vothiphat_223,24,nam,"Đường Lê Lợi, Phường Bến Thành, Quận 1",12:00-14:00,23,7,0.304,Quận 1,75000,230000,1
224,Võ Phú Hà,vophuha_224,56,nam,"Đường Lương Định Của, Phường An Phú, TP Thủ Đức",16:00-18:00,99,65,0.657,TP Thủ Đức,145000,250000,1
225,Võ Tuấn Bảo,votuanbao_225,42,nam,"Đường Hương Lộ 2, Phường Bình Trị Đông A, Quận Bình Tân",10:00-12:00,13,8,0.615,Quận Bình Tân,180000,215000,1
226,Trần Văn My,tranvanmy_226,16,nam,"Đường Bình Thới, Phường 14, Quận 11",16:00-18:00,10,5,0.5,Quận 11,160000,210000,1
227,Lê Gia Quang,legiaquang_227,27,nam,"Đường An Phú Đông 09, Phường An Phú Đông, Quận 12",20:00-22:00,39,10,0.256,Quận 12,100000,130000,1
228,Bùi Hồng Quyên,buihongquyen_228,46,nữ,"Đường Thạnh Lộc 19, Phường Thạnh Lộc, Quận 12",08:00-10:00,13,12,0.923,Quận 12,105000,230000,1
229,Lê Văn Hùng,levanhung_229,20,nam,"Đường Phan Huy Ích, Phường 14, Quận Gò Vấp",19:00-21:00,58,0,0.0,Quận Gò Vấp,190000,220000,1
230,Lâm Thanh Tùng,lamthanhtung_230,33,nữ,"Đường Chu Văn An, Phường 26, Quận Bình Thạnh",06:00-08:00,22,9,0.409,Quận Bình Thạnh,160000,230000,1
231,Lý Quang Trí,lyquangtri_231,41,nữ,"Đường Trường Sa, Phường 12, Quận 3",12:00-14:00,41,24,0.585,Quận 3,145000,165000,1
232,Bùi Thanh Trí,buithanhtri_232,48,nữ,"Đường Nguyễn Thượng Hiền, Phường 5, Quận Phú Nhuận",20:00-22:00,22,4,0.182,Quận Phú Nhuận,140000,180000,1
233,Bùi Quang Yến,buiquangyen_233,53,nam,"Đường Trần Xuân Soạn, Phường Tân Hưng, Quận 7",07:00-09:00,32,18,0.562,Quận 7,250000,250000,1
234,Võ Thị Thắng,vothithang_234,31,nam,"Đường Nguyễn Văn Linh, Phường Tân Phú, Quận 7",19:00-21:00,78,18,0.231,Quận 7,75000,100000,1
235,Phạm Phú Hiếu,phamphuhieu_235,25,nam,"Đường Lê Văn Sỹ, Phường 13, Quận Phú Nhuận",18:00-20:00,6,1,0.167,Quận Phú Nhuận,95000,230000,1
236,Vũ Hoàng Quân,vuhoangquan_236,50,nữ,"Đường Đinh Tiên Hoàng, Phường Đa Kao, Quận 1",09:00-11:00,33,6,0.182,Quận 1,85000,220000,1
237,Lê Đức Hòa,leduchoa_237,15,nữ,"Đường Lê Văn Sỹ, Phường 10, Quận Phú Nhuận",19:00-21:00,95,76,0.8,Quận Phú Nhuận,115000,150000,1
238,Vũ Hồng Linh,vuhonglinh_238,32,nam,"Đường Trần Quang Diệu, Phường 12, Quận 3",18:00-20:00,82,26,0.317,Quận 3,50000,145000,1
239,Bùi Gia Nhật,buigianhat_239,29,không muốn tiết lộ,"Đường Tô Hiến Thành, Phường 14, Quận 10",20:00-22:00,100,93,0.93,Quận 10,215000,230000,1
240,Trần Ngọc Quyên,tranngocquyen_240,36,nữ,"Đường Lý Thường Kiệt, Phường 15, Quận 11",09:00-11:00,76,55,0.724,Quận 11,60000,70000,1
241,Trần Đức Mai,tranducmai_241,15,nam,"Đường Vĩnh Hội, Phường 4, Quận 4",14:00-16:00,84,30,0.357,Quận 4,70000,160000,1
242,Dương Nhật Phong,duongnhatphong_242,21,nữ,"Đường Nguyễn Đình Chiểu, Phường 2, Quận 3",16:00-18:00,10,8,0.8,Quận 3,220000,230000,1
243,Hoàng Tuấn Hùng,hoangtuanhung_243,38,nữ,"Đường Lãnh Binh Thăng, Phường 13, Quận 11",06:00-08:00,88,37,0.42,Quận 11,125000,195000,1
244,Bùi Văn Phúc,buivanphuc_244,52,nữ,"Đường Ba Vân, Phường 14, Quận Tân Bình",20:00-22:00,8,8,1.0,Quận Tân Bình,240000,240000,1
245,Mai Minh Nhật,maiminhnhat_245,30,nữ,"Đường Trường Sa, Phường 13, Quận 3",20:00-22:00,78,76,0.974,Quận 3,75000,230000,1
246,Hoàng Gia Quân,hoanggiaquan_246,36,nữ,"Đường Võ Văn Ngân, Phường Bình Thọ, TP Thủ Đức",14:00-16:00,24,10,0.417,TP Thủ Đức,135000,170000,1
247,Mai Hoàng Phát,maihoangphat_247,24,nam,"Đường Mai Chí Thọ, Phường An Phú, TP Thủ Đức",14:00-16:00,64,62,0.969,TP Thủ Đức,185000,235000,1
248,Phan Phú My,phanphumy_248,23,nữ,"Đường Võ Văn Kiệt, Phường An Lạc, Quận Bình Tân",07:00-09:00,100,28,0.28,Quận Bình Tân,130000,180000,1
249,Huỳnh Gia Hà,huynhgiaha_249,39,nam,"Đường Hai Bà Trưng, Phường Tân Định, Quận 1",16:00-18:00,86,70,0.814,Quận 1,55000,175000,1
250,Lâm Phú Vân,lamphuvan_250,44,nữ,"Đường Nguyễn Trung Trực, Phường Bến Thành, Quận 1",16:00-18:00,89,38,0.427,Quận 1,170000,185000,1
251,Lê Hồng Trinh,lehongtrinh_251,53,nữ,"Đường Lê Lợi, Phường 4, Quận Gò Vấp",19:00-21:00,52,40,0.769,Quận Gò Vấp,190000,225000,1
252,Huỳnh Phú Châu,huynhphuchau_252,20,nữ,"Đường Xa Lộ Hà Nội, Phường Tân Phú, TP Thủ Đức",08:00-10:00,87,56,0.644,TP Thủ Đức,185000,245000,1
253,Đoàn Phú Dũng,doanphudung_253,39,nữ,"Đường Cách Mạng Tháng 8, Phường 5, Quận Tân Bình",20:00-22:00,68,8,0.118,Quận Tân Bình,205000,225000,1
254,Trương Hồng Quang,truonghongquang_254,33,nữ,"Đường Bến Vân Đồn, Phường 2, Quận 4",14:00-16:00,49,37,0.755,Quận 4,245000,245000,1
255,Trần Quang Tùng,tranquangtung_255,30,nam,"Đường Đề Thám, Phường Phạm Ngũ Lão, Quận 1",09:00-11:00,79,9,0.114,Quận 1,65000,235000,1
256,Phan Anh Quang,phananhquang_256,17,nữ,"Đường Trần Hưng Đạo, Phường Cầu Kho, Quận 1",19:00-21:00,30,10,0.333,Quận 1,135000,205000,1
257,Trương Hoàng Duy,truonghoangduy_257,20,nữ,"Đường Tây Hòa, Phường Phước Long A, TP Thủ Đức",09:00-11:00,93,11,0.118,TP Thủ Đức,75000,220000,1
258,Huỳnh Hồng Việt,huynhhongviet_258,56,nữ,"Đường Bưng Ông Thoàn, Phường Phú Hữu, TP Thủ Đức",07:00-09:00,1,1,1.0,TP Thủ Đức,240000,245000,1
259,Lý Minh My,lyminhmy_259,56,nam,"Đường Lê Đức Thọ, Phường 6, Quận Gò Vấp",06:00-08:00,86,6,0.07,Quận Gò Vấp,210000,245000,1
260,Đoàn Hoàng Nhật,doanhoangnhat_260,46,nữ,"Đường Trường Thọ, Phường Trường Thọ, TP Thủ Đức",09:00-11:00,40,13,0.325,TP Thủ Đức,250000,250000,1
261,Võ Minh Nam,vominhnam_261,29,nam,"Đường Xa Lộ Hà Nội, Phường An Phú, TP Thủ Đức",16:00-18:00,27,10,0.37,TP Thủ Đức,60000,140000,1
262,Hoàng Hoàng Thắng,hoanghoangthang_262,44,nam,"Đường Bình Thới, Phường 10, Quận 11",09:00-11:00,56,51,0.911,Quận 11,90000,240000,1
263,Đoàn Phú Bình,doanphubinh_263,47,nam,"Đường Ni Sư Huỳnh Liên, Phường 10, Quận Tân Bình",19:00-21:00,24,6,0.25,Quận Tân Bình,195000,235000,1
264,Đặng Gia My,danggiamy_264,52,nam,"Đường Tây Hòa, Phường Phước Long A, TP Thủ Đức",07:00-09:00,51,31,0.608,TP Thủ Đức,135000,215000,1
265,Trần Ngọc Hòa,tranngochoa_265,59,không muốn tiết lộ,"Đường Tân Kỳ Tân Quý, Phường Sơn Kỳ, Quận Tân Phú",08:00-10:00,80,21,0.263,Quận Tân Phú,250000,250000,1
266,Đặng Minh Thảo,dangminhthao_266,20,nữ,"Đường Đường số 5, Phường Linh Xuân, TP Thủ Đức",09:00-11:00,39,19,0.487,TP Thủ Đức,50000,105000,1
267,Đặng Hoàng Vân,danghoangvan_267,25,nữ,"Đường Tôn Thất Thuyết, Phường 16, Quận 4",09:00-11:00,5,1,0.2,Quận 4,65000,155000,1
268,Phạm Anh Minh,phamanhminh_268,37,nam,"Đường Ưu Long, Phường 11, Quận 8",12:00-14:00,5,2,0.4,Quận 8,120000,190000,1
269,Huỳnh Văn Hùng,huynhvanhung_269,26,nam,"Đường Hưng Phú, Phường 8, Quận 8",10:00-12:00,60,23,0.383,Quận 8,180000,250000,1
270,Phạm Nhật Trí,phamnhattri_270,57,nữ,"Đường Trường Sơn, Phường 2, Quận Tân Bình",07:00-09:00,26,5,0.192,Quận Tân Bình,95000,235000,1
271,Mai Phú Thảo,maiphuthao_271,16,nữ,"Đường Kha Vạn Cân, Phường Linh Tây, TP Thủ Đức",10:00-12:00,73,59,0.808,TP Thủ Đức,170000,215000,1
272,Đỗ Nhật Giang,donhatgiang_272,30,nữ,"Đường Lý Thường Kiệt, Phường 15, Quận 11",09:00-11:00,48,3,0.062,Quận 11,225000,235000,1
273,Bùi Ngọc Hân,buingochan_273,35,không muốn tiết lộ,"Đường Nguyễn Văn Hưởng, Phường Thảo Điền, TP Thủ Đức",06:00-08:00,79,79,1.0,TP Thủ Đức,175000,200000,1
274,Trương Hồng Hòa,truonghonghoa_274,26,nam,"Đường Lê Văn Việt, Phường Hiệp Phú, TP Thủ Đức",20:00-22:00,13,11,0.846,TP Thủ Đức,60000,125000,1
275,Đỗ Minh Linh,dominhlinh_275,37,nam,"Đường Bến Bình Đông, Phường 10, Quận 8",06:00-08:00,7,7,1.0,Quận 8,55000,90000,1
276,Dương Minh Hà,duongminhha_276,32,nam,"Đường Lương Ngọc Quyến, Phường 13, Quận 8",09:00-11:00,47,36,0.766,Quận 8,240000,250000,1
277,Trần Khánh Bảo,trankhanhbao_277,41,nữ,"Đường Hương Lộ 2, Phường Bình Trị Đông, Quận Bình Tân",16:00-18:00,67,63,0.94,Quận Bình Tân,160000,225000,1
278,Lê Phú Hải,lephuhai_278,55,nữ,"Đường Tân Thuận, Phường Tân Thuận Tây, Quận 7",10:00-12:00,87,2,0.023,Quận 7,170000,240000,1
279,Đoàn Anh Mai,doananhmai_279,54,nam,"Đường Nguyễn Thị Nhỏ, Phường 15, Quận 11",09:00-11:00,33,26,0.788,Quận 11,85000,235000,1
280,Vũ Thanh Phong,vuthanhphong_280,54,nam,"Đường Phan Đăng Lưu, Phường 3, Quận Phú Nhuận",20:00-22:00,37,1,0.027,Quận Phú Nhuận,135000,185000,1
281,Lê Thị Nhật,lethinhat_281,28,nữ,"Đường Xóm Củi, Phường 10, Quận 8",12:00-14:00,76,5,0.066,Quận 8,140000,205000,1
282,Mai Văn Nga,maivannga_282,34,nữ,"Đường Trần Hưng Đạo, Phường Nguyễn Cư Trinh, Quận 1",12:00-14:00,74,40,0.541,Quận 1,180000,225000,1
283,Trần Hoàng Nam,tranhoangnam_283,58,nam,"Đường Man Thiện, Phường Tăng Nhơn Phú A, TP Thủ Đức",09:00-11:00,51,34,0.667,TP Thủ Đức,95000,235000,1
284,Hoàng Gia Phong,hoanggiaphong_284,60,nam,"Đường Kênh Tân Hóa, Phường Tân Thới Hòa, Quận Tân Phú",19:00-21:00,9,6,0.667,Quận Tân Phú,175000,185000,1
285,Đặng Khánh Uyên,dangkhanhuyen_285,18,nam,"Đường Trường Sa, Phường 2, Quận Phú Nhuận",09:00-11:00,31,29,0.935,Quận Phú Nhuận,145000,215000,1
286,Nguyễn Hồng Thu,nguyenhongthu_286,50,nam,"Đường Trần Hưng Đạo, Phường Cô Giang, Quận 1",06:00-08:00,15,4,0.267,Quận 1,250000,250000,1
287,Trương Văn Tùng,truongvantung_287,19,nam,"Đường Võ Văn Ngân, Phường Linh Chiểu, TP Thủ Đức",12:00-14:00,43,43,1.0,TP Thủ Đức,215000,245000,1
288,Mai Khánh Chi,maikhanhchi_288,35,nam,"Đường Đặng Văn Bi, Phường Trường Thọ, TP Thủ Đức",20:00-22:00,50,21,0.42,TP Thủ Đức,55000,230000,1
289,Dương Nhật Long,duongnhatlong_289,59,nữ,"Đường Trường Sa, Phường 13, Quận Phú Nhuận",07:00-09:00,28,0,0.0,Quận Phú Nhuận,230000,250000,1
290,Võ Minh Trung,vominhtrung_290,35,nam,"Đường Nguyễn Ảnh Thủ, Phường Thới An, Quận 12",14:00-16:00,98,87,0.888,Quận 12,235000,235000,1
291,Vũ Quang Hân,vuquanghan_291,35,nữ,"Đường Tống Văn Trân, Phường 5, Quận 11",16:00-18:00,40,13,0.325,Quận 11,55000,105000,1
292,Lâm Minh Lan,lamminhlan_292,45,nữ,"Đường Nguyễn Duy, Phường 12, Quận 8",08:00-10:00,15,10,0.667,Quận 8,135000,200000,1
293,Lý Văn Thư,lyvanthu_293,53,nam,"Đường Hương Lộ 2, Phường Bình Trị Đông, Quận Bình Tân",14:00-16:00,74,35,0.473,Quận Bình Tân,140000,195000,1
294,Lâm Ngọc Sơn,lamngocson_294,25,nữ,"Đường Nguyễn Thái Sơn, Phường 4, Quận Gò Vấp",10:00-12:00,55,8,0.145,Quận Gò Vấp,125000,155000,1
295,Nguyễn Quang Nhật,nguyenquangnhat_295,45,nữ,"Đường Hoàng Hữu Nam, Phường Long Bình, TP Thủ Đức",09:00-11:00,79,3,0.038,TP Thủ Đức,195000,205000,1
296,Hoàng Thanh Mai,hoangthanhmai_296,29,nam,"Đường Đường số 10, Phường Tân Quy, Quận 7",20:00-22:00,56,9,0.161,Quận 7,215000,250000,1
297,Đoàn Khánh Ngọc,doankhanhngoc_297,59,nam,"Đường Bến Bình Đông, Phường 13, Quận 8",20:00-22:00,21,7,0.333,Quận 8,60000,100000,1
298,Lý Nhật Tùng,lynhattung_298,48,nam,"Đường Trương Định, Phường Bến Thành, Quận 1",16:00-18:00,43,34,0.791,Quận 1,85000,120000,1
299,Vũ Tuấn Quang,vutuanquang_299,39,nam,"Đường Hoàng Diệu, Phường 10, Quận 4",08:00-10:00,14,11,0.786,Quận 4,50000,195000,1
300,Vũ Đức Linh,vuduclinh_300,52,nữ,"Đường Phạm Văn Hai, Phường 5, Quận Tân Bình",14:00-16:00,67,25,0.373,Quận Tân Bình,110000,195000,1
301,Đỗ Văn Minh,dovanminh_301,40,nữ,"Đường Trần Xuân Soạn, Phường Tân Kiểng, Quận 7",18:00-20:00,38,28,0.737,Quận 7,80000,230000,1
302,Đỗ Thanh Vân,dothanhvan_302,23,nữ,"Đường Rạch Bùng Binh, Phường 10, Quận 3",19:00-21:00,17,8,0.471,Quận 3,145000,165000,1
303,Vũ Minh Tùng,vuminhtung_303,44,nữ,"Đường Cao Thắng, Phường 5, Quận 3",07:00-09:00,59,23,0.39,Quận 3,160000,160000,1
304,Phan Văn Hân,phanvanhan_304,59,nữ,"Đường Trần Văn Đang, Phường 11, Quận 3",10:00-12:00,54,19,0.352,Quận 3,60000,60000,1
305,Mai Quang Phong,maiquangphong_305,14,nữ,"Đường Phan Đình Phùng, Phường 2, Quận Phú Nhuận",08:00-10:00,37,30,0.811,Quận Phú Nhuận,120000,185000,1
306,Dương Phú Uyên,duongphuuyen_306,33,không muốn tiết lộ,"Đường Thích Quảng Đức, Phường 3, Quận Phú Nhuận",18:00-20:00,54,53,0.981,Quận Phú Nhuận,150000,170000,1
307,Phạm Văn Nhật,phamvannhat_307,27,nam,"Đường Hương Lộ 2, Phường Bình Trị Đông, Quận Bình Tân",09:00-11:00,46,42,0.913,Quận Bình Tân,185000,195000,1
308,Nguyễn Văn Ngọc,nguyenvanngoc_308,43,nam,"Đường Đội Cung, Phường 11, Quận 11",10:00-12:00,51,44,0.863,Quận 11,70000,90000,1
309,Trần Quang Trí,tranquangtri_309,37,không muốn tiết lộ,"Đường Võ Văn Ngân, Phường Bình Thọ, TP Thủ Đức",19:00-21:00,87,28,0.322,TP Thủ Đức,245000,250000,1
310,Trương Hồng Tuấn,truonghongtuan_310,17,nữ,"Đường Lãnh Binh Thăng, Phường 13, Quận 11",18:00-20:00,8,8,1.0,Quận 11,100000,245000,1
311,Mai Hoàng Huy,maihoanghuy_311,59,nam,"Đường Phạm Hữu Lầu, Phường Phú Mỹ, Quận 7",12:00-14:00,89,25,0.281,Quận 7,185000,240000,1
312,Nguyễn Hồng Dũng,nguyenhongdung_312,30,nữ,"Đường Ni Sư Huỳnh Liên, Phường 10, Quận Tân Bình",12:00-14:00,81,43,0.531,Quận Tân Bình,95000,220000,1
313,Đoàn Tuấn Hà,doantuanha_313,46,nữ,"Đường Nguyễn Cơ Thạch, Phường Thủ Thiêm, TP Thủ Đức",06:00-08:00,54,43,0.796,TP Thủ Đức,125000,195000,1
314,Trần Quang Thắng,tranquangthang_314,27,nữ,"Đường Mã Lò, Phường Bình Hưng Hòa A, Quận Bình Tân",12:00-14:00,95,26,0.274,Quận Bình Tân,190000,190000,1
315,Huỳnh Hoàng Hà,huynhhoangha_315,40,nam,"Đường Cô Bắc, Phường Cô Giang, Quận 1",07:00-09:00,50,2,0.04,Quận 1,225000,230000,1
316,Bùi Đức Nga,buiducnga_316,21,nữ,"Đường Lê Trọng Tấn, Phường Sơn Kỳ, Quận Tân Phú",10:00-12:00,13,8,0.615,Quận Tân Phú,145000,220000,1
317,Lý Thanh Việt,lythanhviet_317,39,nữ,"Đường Đỗ Quang Đẩu, Phường Phạm Ngũ Lão, Quận 1",16:00-18:00,62,31,0.5,Quận 1,215000,220000,1
318,Vũ Anh Hải,vuanhhai_318,44,nam,"Đường Nguyễn Lâm, Phường 6, Quận 10",06:00-08:00,1,1,1.0,Quận 10,165000,220000,1
319,Hoàng Nhật Anh,hoangnhatanh_319,19,nữ,"Đường Ba Đình, Phường 10, Quận 8",09:00-11:00,83,9,0.108,Quận 8,75000,195000,1
320,Hoàng Khánh Nga,hoangkhanhnga_320,49,không muốn tiết lộ,"Đường Phó Cơ Điều, Phường 4, Quận 11",06:00-08:00,75,12,0.16,Quận 11,210000,235000,1
321,Phạm Gia Việt,phamgiaviet_321,51,nữ,"Đường Quốc Lộ 13, Phường Hiệp Bình Phước, TP Thủ Đức",16:00-18:00,98,11,0.112,TP Thủ Đức,90000,190000,1
322,Hoàng Nhật Châu,hoangnhatchau_322,20,nam,"Đường Vĩnh Hội, Phường 3, Quận 4",07:00-09:00,89,77,0.865,Quận 4,245000,245000,1
323,Nguyễn Đức Hòa,nguyenduchoa_323,54,nữ,"Đường Lý Thường Kiệt, Phường 14, Quận 10",18:00-20:00,47,32,0.681,Quận 10,135000,215000,1
324,Lý Thanh Loan,lythanhloan_324,48,nam,"Đường Tôn Đức Thắng, Phường Bến Nghé, Quận 1",18:00-20:00,41,29,0.707,Quận 1,205000,245000,1
