user_id,name,username,age,gender,user_address,preferred_time_slot,total_booking,cancel_booking,cancel_rate,user_district,min_budget,max_budget,is_banned
485,Đoàn Quang Hòa,doanquanghoa_485,19,nam,"Đường Thống Nhất, Phường 11, Quận Gò Vấp",14:00-16:00,46,17,0.37,Quận Gò Vấp,215000,250000,1
486,Vũ Đức Bảo,vuducbao_486,16,không muốn tiết lộ,"Đường Nguyễn Duy Trinh, Phường Phú Hữu, TP Thủ Đức",08:00-10:00,35,25,0.714,TP Thủ Đức,150000,200000,1
487,Trương Khánh Tuấn,truongkhanhtuan_487,42,không muốn tiết lộ,"Đường Yersin, Phường Cầu Ông Lãnh, Quận 1",10:00-12:00,73,23,0.315,Quận 1,90000,195000,1
488,Bùi Khánh Quân,buikhanhquan_488,53,nam,"Đường Phạm Văn Hai, Phường 1, Quận Tân Bình",06:00-08:00,76,70,0.921,Quận Tân Bình,120000,210000,1
489,Bùi Thị Anh,buithianh_489,48,nữ,"Đường Trần Hưng Đạo, Phường 2, Quận 5",20:00-22:00,61,33,0.541,Quận 5,240000,245000,1
490,Huỳnh Phú Trung,huynhphutrung_490,60,nữ,"Đường Trường Sa, Phường 13, Quận Phú Nhuận",10:00-12:00,95,7,0.074,Quận Phú Nhuận,55000,145000,1
491,Huỳnh Đức Hiếu,huynhduchieu_491,51,nữ,"Đường Ung Văn Khiêm, Phường 25, Quận Bình Thạnh",07:00-09:00,99,96,0.97,Quận Bình Thạnh,155000,195000,1
492,Bùi Hồng Duy,buihongduy_492,19,nữ,"Đường Mai Chí Thọ, Phường An Lợi Đông, TP Thủ Đức",14:00-16:00,59,32,0.542,TP Thủ Đức,145000,200000,1
493,Mai Nhật Quân,mainhatquan_493,59,nữ,"Đường Ông Ích Khiêm, Phường 3, Quận 11",08:00-10:00,40,0,0.0,Quận 11,175000,180000,1
494,Lê Thanh Châu,lethanhchau_494,41,nữ,"Đường Chu Văn An, Phường 2, Quận 6",08:00-10:00,20,7,0.35,Quận 6,70000,155000,1
495,Dương Khánh Hải,duongkhanhhai_495,51,nữ,"Đường Quốc Lộ 1A, Phường An Phú Đông, Quận 12",08:00-10:00,11,3,0.273,Quận 12,170000,200000,1
496,Phan Văn Hiếu,phanvanhieu_496,60,nữ,"Đường Hùng Vương, Phường 12, Quận 5",16:00-18:00,70,41,0.586,Quận 5,95000,170000,1
497,Trần Nhật Thắng,trannhatthang_497,35,nữ,"Đường Phạm Thế Hiển, Phường 5, Quận 8",18:00-20:00,25,10,0.4,Quận 8,200000,240000,1
498,Đoàn Tuấn Huy,doantuanhuy_498,44,nam,"Đường Tản Đà, Phường 11, Quận 5",06:00-08:00,26,10,0.385,Quận 5,130000,250000,1
499,Đặng Thị Trinh,dangthitrinh_499,47,nam,"Đường Sư Vạn Hạnh, Phường 10, Quận 10",20:00-22:00,81,39,0.481,Quận 10,165000,210000,1
500,Lê Khánh Hiếu,lekhanhhieu_500,23,nữ,"Đường Nguyễn Trãi, Phường 8, Quận 5",19:00-21:00,100,60,0.6,Quận 5,95000,95000,1
